------------ CAPTURE OF THE COMPLETE COMMUNICATION ------------------


2: ens33: <BROADCAST,MULTICAST,UP,LOWER_UP> mtu 1500 qdisc fq_codel state UP group default qlen 1000
    link/ether 00:0c:29:32:7a:17 brd ff:ff:ff:ff:ff:ff
    altname enp2s1
    inet 192.168.10.150/24 brd 192.168.10.255 scope global ens33
       valid_lft forever preferred_lft forever


default via 192.168.10.1 dev ens33 proto static 
192.168.10.0/24 dev ens33 proto kernel scope link src 192.168.10.150




20:10:44.171622 IP 192.168.10.193.49124 > 192.168.10.193.80: Flags [S], seq 2856733087, win 65495, options [mss 65495, sackOK, TS val 229676661 ecr 0, nop, wscale 7
J, length 0
20:10:44.171636 IP 192.168.10.193.80 > 192.168.10.193.49124: Flags [S.], seq 2613662624, ack 2856733088, win 65483, options [mss 65495, sackOK, TS val 229676661 e
cr 229676661, nop, wscale 7], length 0
20:10:44.171647 IP 192.168.10.193.49124 > 192.168.10.193.80: Flags [.], ack 1, win 512, options [nop, nop, TS val 229676661 ecr 229676661], length 0
20:10:44.171687 IP 192.168.10.193.49124 > 192.168.10.193.80: Flags
HTTP: GET / HTTP/1.1
20:10:44.171690 IP 192.168.10.193.80 > 192.168.10.193.49124: Flags
20:10:44.173154 IP 192.168.10.193.80 > 192.168.10.193.49124: Flags
5: HTTP: HTTP/1.0 200 OK
20:10:44.173168 IP 192.168.10.193.49124 > 192.168.10.193.80: Flags [.], ack 156, win 511, options [nop, nop, TS val 229676663 ecr 229676663], length 0
20:10:44.173198 IP 192.168.10.193.80 > 192.168.10.193.49124: Flags [P.], seq 156:899, ack 78, win 512, options [nop, nop, TS val 229676663 ecr 229676663], length
743: HTTP
20:10:44.173201 IP 192.168.10.193.49124 > 192.168.10.193.80:
20:10:44.173239 IP 192.168.10.193.80 > 192.168.10.193.49124:
20:10:44.174804 IP 192.168.10.193.49124 > 192.168.10.193.80: Flags
[F.], seq 78, ack 900, win 506, options [nop, nop, TS val 229676664 ecr 229676663],
20:10:44.174820 IP 192.168.10.193.80 > 192.168.10.193.49124: Flags [.], ack 79, win 512, options [nop, nop, TS val 229676664 ecr 229676664], length 0
